{
  "format": "llm-foundations-run-v2",
  "run_id": "66666666-6666-4666-8666-666666666666",
  "job_id": "77777777-7777-4777-8777-777777777777",
  "operation": "chat_generate",
  "backend": "transformers_peft",
  "origin": "locally_created",
  "config": {
    "preview_artifact_id": "88888888-8888-4888-8888-888888888888",
    "max_new_tokens": 64,
    "temperature": 0,
    "top_p": 1,
    "subject": {
      "model_id": "99999999-9999-4999-8999-999999999999",
      "adapter_checkpoint_id": "10101010-1010-4010-8010-101010101010"
    },
    "context_preview_digest": "ffffffffffffffffffffffffffffffffffffffffffffffffffffffffffffffff"
  },
  "seed": 17,
  "dependency_lock_sha256": "aaaaaaaaaaaaaaaaaaaaaaaaaaaaaaaaaaaaaaaaaaaaaaaaaaaaaaaaaaaaaaaa",
  "runtime_profile": "win-cpu",
  "device": "cpu",
  "model_id": "99999999-9999-4999-8999-999999999999",
  "tokenizer_sha256": "bbbbbbbbbbbbbbbbbbbbbbbbbbbbbbbbbbbbbbbbbbbbbbbbbbbbbbbbbbbbbbbb",
  "created_at": "2026-09-28T12:00:00.000Z",
  "chat_template_sha256": "cccccccccccccccccccccccccccccccccccccccccccccccccccccccccccccccc"
}
